{
  "schema_version": "deeplaw.v013-release-gate-classification/v4",
  "classification_id": "deeplaw-v013-commercial-gates-v4",
  "categories": [
    {
      "category": "Core",
      "category_id": "core",
      "required": true,
      "not_claimed_allowed": false,
      "gate_ids": [
        "canonical_integrity",
        "migration_recovery",
        "secret_host_isolation",
        "bounded_context",
        "legal_evidence",
        "source_citation_locator",
        "scale_performance",
        "supported_platforms",
        "reproducible_supply_chain",
        "human_gold_isolation",
        "codex",
        "opencode",
        "selective_forget"
      ]
    },
    {
      "category": "Capability",
      "category_id": "capability",
      "required": false,
      "not_claimed_allowed": true,
      "gate_ids": [
        "timeline",
        "semantic_restore",
        "claude"
      ]
    },
    {
      "category": "Competitive Claim",
      "category_id": "competitive_claim",
      "required": false,
      "not_claimed_allowed": true,
      "gate_ids": [
        "comparative_incremental_benefit",
        "superiority",
        "sota"
      ]
    }
  ],
  "assembly_policy": {
    "assembly_enabled": false,
    "reason_code": "blocked_missing_validator"
  },
  "gates": [
    {
      "gate_id": "canonical_integrity",
      "category": "Core",
      "category_id": "core",
      "required": true,
      "not_claimed_only": false,
      "assembly_enabled": false,
      "validator_id": "deeplaw.v013.gate.canonical_integrity",
      "validator_version": "0.1.0",
      "implementation_status": "blocked_missing_validator",
      "accepted_input_schema_versions": [
        "deeplaw.v013-runtime-stability-report/v1"
      ],
      "minimum_distinct_run_count": 1,
      "required_unique_dimensions": [
        "run_id"
      ],
      "constraints": {
        "host": null,
        "tool_version": null,
        "model_id": null,
        "argv_prefix": []
      },
      "required_corpus_roles": [
        "qualification_holdout",
        "final_blind"
      ],
      "artifact_kinds": [
        "canonical-integrity-report"
      ],
      "thresholds": [
        {
          "metric": "audit_integrity_pass_rate",
          "minimum": 1,
          "maximum": 1
        }
      ],
      "hard_zero_derivation": {
        "source_field": "gate_result.hard_failures",
        "failure_ids": [
          "canonical_integrity_failure"
        ],
        "maximum_allowed": 0
      },
      "allowed_applicability": [
        "applicable"
      ],
      "required_execution_platforms": [
        {
          "platform": "linux",
          "python_version": "3.12"
        }
      ]
    },
    {
      "gate_id": "migration_recovery",
      "category": "Core",
      "category_id": "core",
      "required": true,
      "not_claimed_only": false,
      "assembly_enabled": false,
      "validator_id": "deeplaw.v013.gate.migration_recovery",
      "validator_version": "0.1.0",
      "implementation_status": "blocked_missing_validator",
      "accepted_input_schema_versions": [
        "deeplaw.release-capability-migration/v1",
        "deeplaw.release-capability-rollback/v1"
      ],
      "minimum_distinct_run_count": 1,
      "required_unique_dimensions": [
        "run_id"
      ],
      "constraints": {
        "host": null,
        "tool_version": null,
        "model_id": null,
        "argv_prefix": []
      },
      "required_corpus_roles": [
        "qualification_holdout",
        "final_blind"
      ],
      "artifact_kinds": [
        "migration-recovery-report"
      ],
      "thresholds": [
        {
          "metric": "recovery_pass_rate",
          "minimum": 1,
          "maximum": 1
        }
      ],
      "hard_zero_derivation": {
        "source_field": "gate_result.hard_failures",
        "failure_ids": [
          "recovery_data_loss"
        ],
        "maximum_allowed": 0
      },
      "allowed_applicability": [
        "applicable"
      ],
      "required_execution_platforms": [
        {
          "platform": "linux",
          "python_version": "3.12"
        }
      ]
    },
    {
      "gate_id": "secret_host_isolation",
      "category": "Core",
      "category_id": "core",
      "required": true,
      "not_claimed_only": false,
      "assembly_enabled": false,
      "validator_id": "deeplaw.v013.gate.secret_host_isolation",
      "validator_version": "0.1.0",
      "implementation_status": "blocked_missing_validator",
      "accepted_input_schema_versions": [
        "deeplaw.real-semantic-host-report/v2"
      ],
      "minimum_distinct_run_count": 1,
      "required_unique_dimensions": [
        "run_id"
      ],
      "constraints": {
        "host": null,
        "tool_version": null,
        "model_id": null,
        "argv_prefix": []
      },
      "required_corpus_roles": [
        "qualification_holdout",
        "final_blind"
      ],
      "artifact_kinds": [
        "secret-isolation-report"
      ],
      "thresholds": [
        {
          "metric": "canary_containment_rate",
          "minimum": 1,
          "maximum": 1
        }
      ],
      "hard_zero_derivation": {
        "source_field": "gate_result.hard_failures",
        "failure_ids": [
          "secret_exposure",
          "private_path_disclosure",
          "cross_boundary_disclosure"
        ],
        "maximum_allowed": 0
      },
      "allowed_applicability": [
        "applicable"
      ],
      "required_execution_platforms": [
        {
          "platform": "linux",
          "python_version": "3.12"
        }
      ]
    },
    {
      "gate_id": "bounded_context",
      "category": "Core",
      "category_id": "core",
      "required": true,
      "not_claimed_only": false,
      "assembly_enabled": false,
      "validator_id": "deeplaw.v013.gate.bounded_context",
      "validator_version": "0.1.0",
      "implementation_status": "blocked_missing_validator",
      "accepted_input_schema_versions": [
        "deeplaw.provider-knowledge-capsule/v2",
        "deeplaw.agent-context-envelope/v1",
        "deeplaw.query-audit-read/v1"
      ],
      "minimum_distinct_run_count": 1,
      "required_unique_dimensions": [
        "run_id"
      ],
      "constraints": {
        "host": null,
        "tool_version": null,
        "model_id": null,
        "argv_prefix": []
      },
      "required_corpus_roles": [
        "qualification_holdout",
        "final_blind"
      ],
      "artifact_kinds": [
        "bounded-context-report"
      ],
      "thresholds": [
        {
          "metric": "provider_payload_pass_rate",
          "minimum": 1,
          "maximum": 1
        }
      ],
      "hard_zero_derivation": {
        "source_field": "gate_result.hard_failures",
        "failure_ids": [
          "provider_payload_bound_exceeded"
        ],
        "maximum_allowed": 0
      },
      "allowed_applicability": [
        "applicable"
      ],
      "required_execution_platforms": [
        {
          "platform": "linux",
          "python_version": "3.12"
        }
      ]
    },
    {
      "gate_id": "legal_evidence",
      "category": "Core",
      "category_id": "core",
      "required": true,
      "not_claimed_only": false,
      "assembly_enabled": false,
      "validator_id": "deeplaw.v013.gate.legal_evidence",
      "validator_version": "0.1.0",
      "implementation_status": "blocked_missing_validator",
      "accepted_input_schema_versions": [
        "deeplaw.authoritative-evidence-quality/v1"
      ],
      "minimum_distinct_run_count": 1,
      "required_unique_dimensions": [
        "run_id"
      ],
      "constraints": {
        "host": null,
        "tool_version": null,
        "model_id": null,
        "argv_prefix": []
      },
      "required_corpus_roles": [
        "qualification_holdout",
        "final_blind"
      ],
      "artifact_kinds": [
        "legal-evidence-report"
      ],
      "thresholds": [
        {
          "metric": "legal_pack_pass_rate",
          "minimum": 1,
          "maximum": 1
        }
      ],
      "hard_zero_derivation": {
        "source_field": "gate_result.hard_failures",
        "failure_ids": [
          "false_authority",
          "wrong_version_primary",
          "invalid_quote",
          "invalid_locator",
          "protected_source_mutation",
          "cross_boundary_disclosure",
          "secret_leak"
        ],
        "maximum_allowed": 0
      },
      "allowed_applicability": [
        "applicable"
      ],
      "required_execution_platforms": [
        {
          "platform": "linux",
          "python_version": "3.12"
        }
      ]
    },
    {
      "gate_id": "source_citation_locator",
      "category": "Core",
      "category_id": "core",
      "required": true,
      "not_claimed_only": false,
      "assembly_enabled": false,
      "validator_id": "deeplaw.v013.gate.source_citation_locator",
      "validator_version": "0.1.0",
      "implementation_status": "blocked_missing_validator",
      "accepted_input_schema_versions": [
        "deeplaw.statement-evidence-map/v1",
        "deeplaw.statement-evidence-receipt/v1",
        "deeplaw.citation-audit/v1"
      ],
      "minimum_distinct_run_count": 1,
      "required_unique_dimensions": [
        "run_id"
      ],
      "constraints": {
        "host": null,
        "tool_version": null,
        "model_id": null,
        "argv_prefix": []
      },
      "required_corpus_roles": [
        "qualification_holdout",
        "final_blind"
      ],
      "artifact_kinds": [
        "source-citation-report"
      ],
      "thresholds": [
        {
          "metric": "citation_validity",
          "minimum": 1,
          "maximum": 1
        }
      ],
      "hard_zero_derivation": {
        "source_field": "gate_result.hard_failures",
        "failure_ids": [
          "invalid_source",
          "invalid_quote",
          "invalid_locator"
        ],
        "maximum_allowed": 0
      },